{
  "claim_id": "C-EXAMPLE",
  "claim": "ready",
  "task_id": "T-EXAMPLE",
  "plan_revision": 1,
  "run_id": "RUN-EXAMPLE",
  "attempt_id": "ATT-EXAMPLE",
  "task_revision": 1,
  "workspace_hash": "0000000000000000000000000000000000000000000000000000000000000000",
  "profile_id": "personal",
  "change_kind": "documentation",
  "evidence_ids": ["E-EXAMPLE-GREEN"],
  "acceptance_criteria": [
    {
      "criterion_id": "AC-EXAMPLE",
      "evidence_ids": ["E-EXAMPLE-GREEN"]
    }
  ]
}
